[{"id":"banded_mail","name":"Banded mail","kind":"armor","baseAC":4,"cost":"200 gp","weight":"35 lbs."},{"id":"brigandine","name":"Brigandine","kind":"armor","baseAC":6,"cost":"120 gp","weight":"35 lbs."},{"id":"bronze_plate_mail","name":"Bronze plate mail","kind":"armor","baseAC":4,"cost":"400 gp","weight":"45 lbs."},{"id":"chain_mail","name":"Chain mail","kind":"armor","baseAC":5,"cost":"75 gp","weight":"40 lbs."},{"id":"field_plate","name":"Field plate","kind":"armor","baseAC":2,"cost":"2000 gp","weight":"60 lbs."},{"id":"full_plate","name":"Full plate","kind":"armor","baseAC":1,"cost":"4,000-10,000 gp","weight":"70 lbs."},{"id":"great_helm","name":"Great helm","kind":"helmet","baseAC":null,"cost":"30 gp","weight":"10 lbs."},{"id":"basinet","name":"Basinet","kind":"helmet","baseAC":null,"cost":"8 gp","weight":"5 lbs."},{"id":"hide","name":"Hide","kind":"armor","baseAC":6,"cost":"15 gp","weight":"30 lbs."},{"id":"leather","name":"Leather","kind":"armor","baseAC":8,"cost":"5 gp","weight":"15 lbs."},{"id":"padded","name":"Padded","kind":"armor","baseAC":8,"cost":"4 gp","weight":"10 lbs."},{"id":"plate_mail","name":"Plate mail","kind":"armor","baseAC":3,"cost":"600 gp","weight":"50 lbs."},{"id":"ring_mail","name":"Ring mail","kind":"armor","baseAC":7,"cost":"100 gp","weight":"30 lbs."},{"id":"scale_mail","name":"Scale mail","kind":"armor","baseAC":6,"cost":"120 gp","weight":"40 lbs."},{"id":"body_shield","name":"Body Shield","kind":"shield","baseAC":null,"cost":"10 gp","weight":"15 lbs."},{"id":"buckler_shield","name":"Buckler Shield","kind":"shield","baseAC":null,"cost":"1 gp","weight":"3 lbs."},{"id":"medium_shield","name":"Medium Shield","kind":"shield","baseAC":null,"cost":"7 gp","weight":"10 lbs."},{"id":"small_shield","name":"Small Shield","kind":"shield","baseAC":null,"cost":"3 gp","weight":"5 lbs."},{"id":"splint_mail","name":"Splint mail","kind":"armor","baseAC":4,"cost":"80 gp","weight":"40 lbs."},{"id":"studded_leather","name":"Studded leather","kind":"armor","baseAC":7,"cost":"20 gp","weight":"25 lbs."}]